{
  "schema_version": "1.0",
  "registry_id": "tencent.wechat.logs@1.0.0",
  "rule_id": "tencent.wechat.logs",
  "rule_version": "1.0.0",
  "synthetic": false,
  "subject": {
    "kind": "app",
    "id": "tencent.wechat",
    "name": "WeChat (Weixin)"
  },
  "version_range": {
    "min_inclusive": "4.1",
    "max_exclusive": "4.2"
  },
  "platforms": [
    {
      "platform": "windows",
      "os_versions": [
        "10.0.26200"
      ],
      "architectures": [
        "x64"
      ]
    }
  ],
  "tested_at": "2026-10-15",
  "result": "passed",
  "fixtures": {
    "positive": [
      "30-day-old *.xlog files in xwechat\\log and log\\radium are review-only candidates"
    ],
    "negative": [
      "A log written today, the mm.mmap3 log buffer and logs two folders deep are not matched",
      "Real logs on this device are newer than 7 days and were correctly not candidates"
    ]
  },
  "known_effects": [
    "Past WeChat diagnostic logs are no longer available."
  ],
  "evidence_refs": [
    "run_win_catalog_tencent_wechat_logs"
  ],
  "thresholds": {
    "min_age_days": 7,
    "age_basis": "modified_time",
    "min_size_bytes": null,
    "retention_days": null
  }
}
