{
  "schema_version": "1.0",
  "registry_id": "bytedance.feishu.code-cache@1.0.0",
  "rule_id": "bytedance.feishu.code-cache",
  "rule_version": "1.0.0",
  "synthetic": false,
  "subject": {
    "kind": "app",
    "id": "bytedance.feishu",
    "name": "Feishu"
  },
  "version_range": {
    "min_inclusive": "7.75",
    "max_exclusive": "7.76"
  },
  "platforms": [
    {
      "platform": "windows",
      "os_versions": [
        "10.0.26200"
      ],
      "architectures": [
        "x64"
      ]
    }
  ],
  "tested_at": "2026-10-15",
  "result": "passed",
  "fixtures": {
    "positive": [
      "Real %APPDATA%\\LarkShell\\CodeCache matched as the only candidate"
    ],
    "negative": [
      "A nested Default\\CodeCache, the shader caches, profile state and databases are not matched"
    ]
  },
  "known_effects": [
    "Feishu recompiles its scripts on the next start; skipped while Feishu runs or holds a file open."
  ],
  "evidence_refs": [
    "run_win_catalog_bytedance_feishu_code_cache"
  ],
  "thresholds": {
    "min_age_days": null,
    "age_basis": null,
    "min_size_bytes": null,
    "retention_days": null
  }
}
