{
  "schema_version": "1.0",
  "registry_id": "google.chrome.code-cache@1.0.0",
  "rule_id": "google.chrome.code-cache",
  "rule_version": "1.0.0",
  "synthetic": false,
  "subject": {
    "kind": "app",
    "id": "google.chrome",
    "name": "Google Chrome"
  },
  "version_range": {
    "min_inclusive": "155.0",
    "max_exclusive": "156.0"
  },
  "platforms": [
    {
      "platform": "windows",
      "os_versions": [
        "10.0.26200"
      ],
      "architectures": [
        "x64"
      ]
    }
  ],
  "tested_at": "2026-10-15",
  "result": "passed",
  "fixtures": {
    "positive": [
      "Headless throwaway profile: Default\\Code Cache created and matched as the only candidate"
    ],
    "negative": [
      "Cache, GPUCache, Service Worker and Local Storage are not matched",
      "Code Cache recreated after removal; page still renders"
    ]
  },
  "known_effects": [
    "Pages run script slightly slower until the cache is rebuilt.",
    "Skipped at execution while the browser is running."
  ],
  "evidence_refs": [
    "run_win_rule_google_chrome_code_cache"
  ],
  "thresholds": {
    "min_age_days": null,
    "age_basis": null,
    "min_size_bytes": null,
    "retention_days": null
  }
}
