{
  "schema_version": "1.0",
  "registry_id": "windows.crash-dumps.user@1.0.0",
  "rule_id": "windows.crash-dumps.user",
  "rule_version": "1.0.0",
  "synthetic": false,
  "subject": {
    "kind": "system",
    "id": "windows.crash-dumps",
    "name": "Windows user crash dumps"
  },
  "version_range": {
    "min_inclusive": "10.0.26200",
    "max_exclusive": "10.0.26201"
  },
  "platforms": [
    {
      "platform": "windows",
      "os_versions": [
        "10.0.26200"
      ],
      "architectures": [
        "x64"
      ]
    }
  ],
  "tested_at": "2026-10-15",
  "result": "passed",
  "fixtures": {
    "positive": [
      "30-day-old .dmp is a review-only candidate"
    ],
    "negative": [
      "A dump from today is not a candidate",
      "A non-dump file is not matched"
    ]
  },
  "known_effects": [
    "The dumps are no longer available for debugging."
  ],
  "evidence_refs": [
    "run_win_catalog_windows_crash_dumps_user"
  ],
  "thresholds": {
    "min_age_days": 7,
    "age_basis": "modified_time",
    "min_size_bytes": null,
    "retention_days": null
  }
}
